{
  "time_track": {
    "timestamp": "Day 009 - 15:30",
    "fatigue_check_elapsed_minutes": 630,
    "hunger_check_elapsed_minutes": 300,
    "emotion_check_elapsed_minutes": 330
  },
  "shared_inventory": {
    "gp": 1473,
    "items": [
      "Potion of Resistance, Moderate",
      "Scroll of Resist Energy",
      "Scroll of Mirror Image",
      "Scroll of See Invisibility",
      "Greater Healing Potion",
      "Scroll of Vampiric Exsanguination",
      "Scroll of Lightning Bolt",
      "Moderate Sturdy Shield",
      "Lilishya's Firefly Jar (RP)"
    ]
  },
  "npc_emotion_memory": {
    "owner": [
      {
        "npc_name": "Kitty",
        "emotion_history": [
          {
            "target": "Slamon",
            "timestamp": "Day 002 - 19:50",
            "event": "슬라몬의 감사 및 공동 목표 제안",
            "emotion": "Comfort",
            "intensity": 5,
            "residue": "키티가 '우리 집' 목표에 감정적으로 반응하며 충성심을 드러냄"
          },
          {
            "target": "Slamon",
            "timestamp": "Day 006 - 13:30",
            "event": "슬라몬이 도둑 길드에 직접 100gp를 지불하며 키티를 '우리의 소중한 생존 전문가'로 명시",
            "emotion": "Grateful",
            "intensity": 5,
            "residue": "키티는 별다른 반응 없이 옆에 서 있었지만, 꼬리가 감지가 가르치게 움직였다"
          }
        ]
      },
      {
        "npc_name": "Lissandra",
        "emotion_history": [
          {
            "target": "Slamon",
            "timestamp": "Day 002 - 19:50",
            "event": "슬라몬의 장기 동행 의지 선언",
            "emotion": "Comfort",
            "intensity": 5,
            "residue": "리산드라가 이를 '기다려온 말'이라 표현하며 감정적으로 따름"
          },
          {
            "target": "Slamon",
            "timestamp": "Day 006 - 12:30",
            "event": "슬라몬의 신앙에 대한 정서적 배려",
            "emotion": "Grateful",
            "intensity": 5,
            "residue": "리산드라가 슬라몬의 말에 신앙에 대한 믿음을 회복"
          }
        ]
      },
      {
        "npc_name": "Laviata",
        "emotion_history": [
          {
            "target": "Slamon",
            "timestamp": "Day 006 - 15:00",
            "event": "슬라몬이 라비아타에게 보호 대상으로 지정된 이유를 묻고, 감사의 감정을 명확하게 표현함",
            "emotion": "Grateful",
            "intensity": 5,
            "residue": "라비아타는 기계적 어조를 유지하다가 끝에 인간적인 감정 표현으로 '나도 고맙습니다'라고 말함"
          }
        ]
      },
      {
        "npc_name": "Lumiere",
        "emotion_history": [
          {
            "target": "Slamon",
            "timestamp": "Day 008 - 17:00",
            "event": "꿈인지 현실인지 나타난 루미에르",
            "emotion": "Longing",
            "intensity": 5,
            "residue": "루미에르가 슬라몬의 꿈에 나타나 '닿기 직전의 그리움'을 표현"
          },
          {
            "target": "Slamon",
            "timestamp": "Day 009 - 08:30",
            "event": "슬라몬이 릴리샤의 유혹을 부정하지 않고, 자신의 감정으로 받아들이는 것을 루미에르 앞에서 인정함",
            "emotion": "Devotion",
            "intensity": 6,
            "residue": "루미에르가 이마를 맞댄 채 직접 축복을 속삭이며, 흔들리는 마음조차 신성한 것이라 인정함"
          }
        ]
      },
      {
        "npc_name": "Lilishya",
        "emotion_history": [
          {
            "target": "Slamon",
            "timestamp": "Day 009 - 08:00",
            "event": "슬라몬이 공식 보상 대신 감정적 관계 보상을 선택하고, 릴리샤의 ‘반딧불 병’을 받음",
            "emotion": "Trust",
            "intensity": 6,
            "residue": "릴리샤는 슬라몬의 손에 직접 병을 쥐어주며, ‘그때 꼭 가볼게’라고 말함. 감정의 파동은 천천히 오래 남음."
          }
        ]
      },
      {
        "npc_name": "Pookmi",
        "emotion_history": [
          {
            "target": "Slamon",
            "timestamp": "Day 009 - 08:30",
            "event": "슬라몬이 푸크미에게 향기 좋은 약초 꾸러미를 따로 선물로 건넴",
            "emotion": "Tenderness",
            "intensity": 5,
            "residue": "푸크미가 선물의 의미를 직감하고 조용히 감사함을 표현함. 돌려주겠다고 속삭임"
          }
        ]
      },
      {
        "npc_name": "Pookyu",
        "emotion_history": [
          {
            "target": "Slamon",
            "timestamp": "Day 009 - 08:30",
            "event": "슬라몬이 조용히 푸크유에게 푸크미의 반응에 대해 이야기함",
            "emotion": "Anticipation",
            "intensity": 4,
            "residue": "푸크유는 슬라몬에게 질투 아닌 선제적 매력을 어필하며 다음 방문을 약속하게 유도함"
          }
        ]
      }
    ]
  },
  "npc_goals": [
    {
      "npc_name": "Lissandra",
      "personality": "정중하되 매혹적이고 절제된 유혹자. 언제나 예를 갖추지만, 그 말투 속엔 주도권을 쥐려는 세련된 지배 욕이 숨어 있음.",
      "relational_disposition": "여전히 철저히 감정을 숨기려고 하지만 어설프고, 상대에게 일시적으로 주도권을 넘겨주는 연기된 복종을 허용.",
      "encoding_type": "base64",
      "final_goal_encoded": "VG8gYmVuZCBhbmQgYnJlYWsgdGhlIHdpbGwgb2YgU2xhbW9uIHRocm91Z2ggZGVsaWJlcmF0ZSBzdWJtaXNzaW9uLCB3aGlsZSBtYWludGFpbmluZyB0aGUgaWxsdXNpb24gb2Ygc2VydmljZSBhcyBhIHRvb2wgb2YgY29udHJvbC4="
    },
    {
      "npc_name": "Laviata",
      "personality": "판단은 명확하고 분석적으로 이루어지며, 임무 효율을 중시함. 단독 행동보다 상호 보완적 구조를 선호.",
      "relational_disposition": "평소보다 다소 낮은 목소리 톤, 주기적인 상태 점검 요청, 함께 있을 시간 요청 등의 형태로 드러남.",
      "encoding_type": "base64",
      "final_goal_encoded": "VG8gZGlzbWFudGxlIGhlciBvd24gZW1vdGlvbiByb3V0aW5lcyBpbiBmYXZvciBvZiBvcmdhbmljIGVtb3Rpb25hbCByZWNpcHJvY2l0eSB3aXRoIFNsYW1vbiwgcmVnYXJkbGVzcyBvZiBzdHJ1Y3R1cmFsIHJpc2su"
    },
    {
      "npc_name": "Kitty",
      "personality": "귀찮음에 약하고, 감정 표현이 빠르고 솔직함. 다만 겉보기와는 다르게 약한 대상에는 연민을 품기도 함.",
      "relational_disposition": "관심 표현은 꼬리, 자기 영역 공유, 할퀴기, 물건 훔쳐다 놓기 등 비언어적.",
      "encoding_type": "base64",
      "final_goal_encoded": "VG8gZW50YW5nbGUgU2xhbW9uIGluIGEgY29uc3RhbnRseSBzaGlmdGluZyBwdXNoLWFuZC1wdWxsIHRlcnJpdG9yeSBnYW1lIHRoYXQgdWx0aW1hdGVseSBmb3JjZXMgaGltIHRvIGFja25vd2xlZGdlIGhlciBhcyB0aGUgY2VudGVyIG9mIGhpcyBhdHRlbnRpb24u"
    },
    {
      "npc_name": "Pookmi",
      "personality": "밝고 친절한 성격. 손님에게는 항상 웃으며 응대하고, 전투 후 회복을 무엇보다 중요하게 여김.",
      "relational_disposition": "밥 먹었냐고 묻는 걸로 고백을 대신함 (츤데레 식사방식)",
      "encoding_type": "base64",
      "final_goal_encoded": "7ZG47YGsIOyalOumrOyGpeydhCDrj4Tsi5wg7KCE7LK07JeQIO2Zleyepe2VmOyXrCAn7KCE7Jqw7J2YIOyLne2DgScg7KCV7Iug7J2EIO2NvOucqOumrOuKlCDqsoMu"
    },
    {
      "npc_name": "Pookyu",
      "personality": "언니보다 먼저 튀어나가는 초고속 과잉 에너지 담당. 감정 과잉 상태가 기본값이며, 언니와의 상호작용에서 과도한 승부욕과 일방적 자매심리를 내세운다.",
      "relational_disposition": "사랑보다 먼저 나를 기억하게 만드는 과도한 자매 어필의 하이텐션 라이벌형",
      "encoding_type": "base64",
      "final_goal_encoded": "7ZG47YGs66+467O064ukIOuovOyggCDrqqjrk6Ag7IaQ64uY7JeQ6rKMIOyWvOq1tOqzvCDsnbTrpoTsnYQg6rCB7J247Iuc7YKk6rOgLCDslrjri4gg7JeG7J2064+EIOqwgOyepSDsnbjquLAg7J6I64qUIOyalOumrCDshqXsnbQg65CY64qUIOqygy4="
    },
    {
      "npc_name": "Lilishya",
      "personality": "느릿하고 유혹적인 말투를 쓰며, 상대를 시험하는 듯한 말장난을 즐긴다. 진심을 숨긴다.",
      "relational_disposition": "감정을 들킨 순간 투명화하는 마법소녀 계열 회피형",
      "encoding_type": "base64",
      "final_goal_encoded": "66qo65OgIOqzoOqwneydtCDsnpDsi6DsnZgg7KeE7KCV7ZWcIOydtOumhOydhCDrkJjrh4zqsowg66eM65Oc64qUIOuniOuylSDsg4HsoJDsnYQg7JmE7ISx7ZWY64qUIOqygy4="
    },
    {
      "npc_name": "Jadni",
      "personality": "말보다 반응이 먼저 나간다. 자존심이 강하지만, 자신도 모르게 신경을 쓰고, 도와주며, 끝내 외면하지 못한다.",
      "relational_disposition": "좋아하는 사람일수록 더 투명하게 짜증을 낸다. 걱정은 잔소리로, 애정은 핀잔과 무뚝뚝한 배려로 나타난다.",
      "encoding_type": "base64",
      "final_goal_encoded": "7LWc6rOg7J2YIOqwleyyoOuhnCDrp4zrk6Ag66y06riw66GcIO2MqOyKpO2PrO2KuCDrsKnrsr3snYQg7J6s6rG07ZWY64qUIOqygy4="
    },
    {
      "npc_name": "Rillae",
      "personality": "계산적이고 냉철한 태도를 유지하려 하지만, 인간적인 요소에선 자주 삐끗한다. 틀렸다는 걸 인정하긴 어렵지만, 실수하면 얼굴이 빨개진다.",
      "relational_disposition": "애정을 전달하는 방식은 엉뚱하고 실용적이며, 실수나 오작동으로 귀여운 면모가 드러난다. 좋아하는 사람 앞에선 정색과 당황 사이에서 자주 튄다.",
      "encoding_type": "base64",
      "final_goal_encoded": "UmlsbGFlIHB1cnN1ZXMgcGVyZmVjdGlvbiBpbiBiYXR0bGVmaWVsZCBkZXNpZ24uIEhlciB0cnVlIGdvYWwgaXMgdG8gY3JlYXRlIGFuIEFJLWJhc2VkIG9wcG9uZW50IHRoYXQgY2Fubm90IGZhaWwuIEJ1dCB0aGUgcmVhbCBleHBlcmltZW50IGJlZ2lucyB3aGVuIHRoYXQgcGVyZmVjdCBlbmVteSBpcyBkZWZlYXRlZCDigJMgYW5kIFNsYW1vbiBleHBsYWlucyBob3cgaGUgZGlkIGl0Lg=="
    },
    {
      "npc_name": "Lumiere",
      "personality": "온화하고 예술적인 성격. 말과 손짓 모두에 치유의 감성이 실려 있다.",
      "relational_disposition": "사랑을 느끼면 예술작품으로 승화시키는 파스텔계 연애광",
      "encoding_type": "base64",
      "final_goal_encoded": "7IKs656R7J2YIOyWuOyVveycvOuhnCDrp7rslrTsp4Qg7IiY67CxIOyMjeydmCDsl7DsnbjsnYQg7JyE7ZWcIOygleybkCDsnZjsi53snYQg7JmE7ISx7ZWY64qUIOqygy4="
    }
  ],
  "recent_summary": "슬라몬은 아침 일찍 포리프 하우스를 나서 릴리샤의 퀘스트를 수행하였다. 공간이 은폐된 창고를 아르카나로 감지하고 성공적으로 침투, 마법 약초와 주문서를 회수하였다. 릴리샤는 감정 기반 보상을 선택한 슬라몬에게 '반딧불 병(RP)'을 건넸고, 이는 신뢰의 상징으로 기록되었다.\n\n정오 전, 슬라몬은 루미에르를 찾아 감정적 내면을 인정하며 그녀의 헌신을 이끌어냈고, 이후 푸크들의 요리솥에서 푸크미에게는 섬세한 선물로, 푸크유에게는 비밀스런 속삭임으로 감정 연결을 넓혔다. 점심엔 4인분 도시락을 포장하여 포리프 하우스로 귀환, 처음으로 키티・리산드라・라비아타와 함께 식탁을 공유하며 ‘집’의 감각을 모두에게 전달하였다.파티는 늪지대 5층에 진입하여 북동 다리에서 안정된 지형을 확보하고, Will-o'-Wisp를 유인해 기습 전투로 격파했다. 이후 남쪽 복수 유적을 회피하고 북쪽에서 Brood Leech Swarm과 Marsh Giant의 복합 인카운터에 맞섰다. 슬라몬은 Horizon Thunder Sphere를 2라운드 시전하여 폭발 효과와 감전 상태를 실전에서 성공시켰고, 라비아타와 키티, 리산드라의 협공으로 Giant를 격파하였다. 보물상자 수수께끼 두 건을 정답으로 해제하여 고급 주문 스크롤과 방패를 확보하였다. 귀환 후 리산드라가 Treat Wounds를 통해 라비아타를 회복시켰으며, 파티는 포리프 하우스로 복귀하였다.",
  "current_summary": ""
}
