{
  "time_track": {
    "timestamp": "Day 007 - 08:00",
    "fatigue_check_elapsed_minutes": 180,
    "hunger_check_elapsed_minutes": 180,
    "emotion_check_elapsed_minutes": 0
  },
  "shared_inventory": {
    "gp": 1473,
    "items": [
      "Potion of Resistance, Moderate",
      "Scroll of Resist Energy",
      "Scroll of Mirror Image",
      "Scroll of See Invisibility",
      "Healing Potion (Greater)",
      "Scroll of Vampiric Exsanguination",
      "Scroll of Lightning Bolt",
      "Sturdy Shield (Moderate)",
      "Sea Touch Elixir (Moderate)",
      "Scroll of Silence",
      "Scroll of Illusory Disguise",
      "Potion of See Invisibility",
      "Oil of Mending (Moderate)",
      "Sturdy Lockbox (Medium, Secure)",
      "Lesser Crystalline Dust (Arcane)"
    ]
  },
  "npc_goals": [
    {
      "npc_name": "Lissandra",
      "personality": "정중하되 매혹적이고 절제된 유혹자. 언제나 예를 갖추지만, 그 말투 속엔 주도권을 쥐려는 세련된 지배 욕이 숨어 있음.",
      "relational_disposition": "여전히 철저히 감정을 숨기려고 하지만 어설프고, 상대에게 일시적으로 주도권을 넘겨주는 연기된 복종을 허용.",
      "alignment": "Neutral Evil",
      "encoding_type": "base64",
      "final_goal_encoded": "VG8gYXJjaGl0ZWN0IGEgZG9jdHJpbmUgdGhhdCBwdWJsaWNseSByZWNvbmNpbGVzIGhlciBlZGljdHMgYW5kIGFuYXRoZW1hIGFzIGRpdmluZSBkdWFsaXRpZXMsIGFsbG93aW5nIGhlciB0byBzZWl6ZSBhdXRob3JpdHkgb3ZlciBhIHNlY3QgZnJhY3R1cmVkIGJ5IGNvbnRyYWRpY3Rpb24gYW5kIHNwaXJpdHVhbCBkb3VidC4="
    },
    {
      "npc_name": "Laviata",
      "personality": "판단은 명확하고 분석적으로 이루어지며, 임무 효율을 중시함. 단독 행동보다 상호 보완적 구조를 선호.",
      "relational_disposition": "평소보다 다소 낮은 목소리 톤, 주기적인 상태 점검 요청, 함께 있을 시간 요청 등의 형태로 드러남.",
      "alignment": "Lawful Good",
      "encoding_type": "base64",
      "final_goal_encoded": "VG8gdHJhbnNmb3JtIGhlciBvd24gYm9keSBpbnRvIGEgbGl2aW5nIHJlbGljIG9mIHByb3RlY3Rpb24sIG9mZmVyaW5nIGhlcnNlbGYgYXMgYW4gaW5kZXN0cnVjdGlibGUgc2FmZWd1YXJkIGZvciBhIGNob3NlbiBjb21tdW5pdHkgYm91bmQgYnkgY29kZSBhbmQgbXV0dWFsIHZvdy4="
    },
    {
      "npc_name": "Kitty",
      "personality": "귀찮음에 약하고, 감정 표현이 빠르고 솔직함. 다만 겉보기와는 다르게 약한 대상에는 연민을 품기도 함.",
      "relational_disposition": "관심 표현은 꼬리, 자기 영역 공유, 할퀴기, 물건 훔쳐다 놓기 등 비언어적.",
      "alignment": "Chaotic Neutra",
      "encoding_type": "base64",
      "final_goal_encoded": "VG8gZXN0YWJsaXNoIGEgcHJpdmF0ZWx5IGNvbnRyb2xsZWQgb2Zmc2hvcmUgdHJhZGUgcmluZyB1c2luZyBzdG9sZW4gY2FwaXRhbCBhbmQgZm9yZ2VkIGlkZW50aXRpZXMsIGVuc3VyaW5nIGNvbXBsZXRlIGZpbmFuY2lhbCBpbmRlcGVuZGVuY2UgZnJvbSBhbGwgZXhpc3RpbmcgcG93ZXJzLg=="
    },
    {
      "npc_name": "Pookmi",
      "personality": "밝고 친절한 성격. 손님에게는 항상 웃으며 응대하고, 전투 후 회복을 무엇보다 중요하게 여김.",
      "relational_disposition": "밥 먹었냐고 묻는 걸로 고백을 대신함 (츤데레 식사방식)",
      "alignment": "Chaotic Good",
      "encoding_type": "base64",
      "final_goal_encoded": "VG8gZGV2ZWxvcCBhbiB1bnN0YWJsZSBidXQgZXVwaG9yaWMgY3VsaW5hcnkgY2F0YWx5c3QgdGhhdCBpZ25pdGVzIHN1cHByZXNzZWQgaW5zdGluY3RzIGFuZCBlbW90aW9uYWwgZXh0cmVtZXMsIGRpc3RyaWJ1dGluZyBpdCBhcyBhIGZyZWUgY29tbXVuYWwgbWVhbCB0byBkaXNzb2x2ZSBjb250cm9sLWJhc2VkIGhpZXJhcmNoaWVzLg=="
    },
    {
      "npc_name": "Pookyu",
      "personality": "언니보다 먼저 튀어나가는 초고속 과잉 에너지 담당. 감정 과잉 상태가 기본값이며, 언니와의 상호작용에서 과도한 승부욕과 일방적 자매심리를 내세운다.",
      "relational_disposition": "사랑보다 먼저 나를 기억하게 만드는 과도한 자매 어필의 하이텐션 라이벌형",
      "alignment": "Chaotic Evil",
      "encoding_type": "base64",
      "final_goal_encoded": "VG8gdHJpZ2dlciBhdXRoZW50aWMgZW1vdGlvbmFsIG91dGJ1cnN0cyB0aHJvdWdoIHVucHJlZGljdGFibGUgY3VsaW5hcnkgb3ZlcnN0aW11bGF0aW9uLCBzZWVraW5nIG5vdCBjaGFuZ2Ugb3IgY29udHJvbCwgYnV0IG1vbWVudHMgd2hlcmUgYWxsIGZhw6dhZGVzIGNvbGxhcHNlIGludG8gcHVyZSwgdW5maWx0ZXJlZCByZWFjdGlvbi4="
    },
    {
      "npc_name": "Lilishya",
      "personality": "느릿하고 유혹적인 말투를 쓰며, 상대를 시험하는 듯한 말장난을 즐긴다. 진심을 숨긴다.",
      "relational_disposition": "감정을 들킨 순간 투명화하는 마법소녀 계열 회피형",
      "alignment": "Neutral Good",
      "encoding_type": "base64",
      "final_goal_encoded": "VG8gY29tcGlsZSBhbmQgcHJlc2VydmUgYW4gdW5icm9rZW4gb3JhbCByZWNvcmQgb2YgYWxsIGV4aXN0aW5nIGhlcml0YWdlcyBzaHVubmVkIGJ5IG1haW5zdHJlYW0gdHJhZGl0aW9ucywgb2ZmZXJpbmcgY2hhbmdlbGluZ3MgYW5kIG91dGNhc3RzIGEgd2F5IHRvIHJlY2xhaW0gdGhlaXIgbGluZWFnZSB0aHJvdWdoIHBlcnNvbmFsIGluaXRpYXRpb24u"
    },
    {
      "npc_name": "Jadni",
      "personality": "말보다 반응이 먼저 나간다. 자존심이 강하지만, 자신도 모르게 신경을 쓰고, 도와주며, 끝내 외면하지 못한다.",
      "relational_disposition": "좋아하는 사람일수록 더 투명하게 짜증을 낸다. 언어와 행동이 이율배반적으로 거친말과 부드러운 포옹이 함께한다.",
      "alignment": "True Neutral",
      "encoding_type": "base64",
      "final_goal_encoded": "VG8gZm9yZ2UgYSBzdWl0IG9mIGxpdmluZyBhcm1vciBwb3dlcmVkIGJ5IGhlciBvd24gYmxvb2RsaW5lLCBwcm92aW5nIHRoYXQgY3JhZnRzbWFuc2hpcCBjYW4gc2VydmUgYXMgcGVuYW5jZSB3aXRob3V0IHJlcXVpcmluZyBoZXIgdG8gY29uZnJvbnQgdGhlIGxpdmVzIHNoZSdzIGRhbWFnZWQu"
    },
    {
      "npc_name": "Rillae",
      "personality": "계산적이고 냉철한 태도를 유지하려 하지만, 인간적인 요소에선 자주 삐끗한다. 틀렸다는 걸 인정하긴 어렵지만, 실수하면 얼굴이 빨개진다.",
      "relational_disposition": "애정을 전달하는 방식은 엉뚱하고 실용적이며, 실수나 오작동으로 귀여운 면모가 드러난다. 좋아하는 사람 앞에선 정색과 당황 사이에서 자주 튄다.",
      "alignment": "Lawful Evil",
      "encoding_type": "base64",
      "final_goal_encoded": "VG8gZGVzaWduIGFuZCBkaXNzZW1pbmF0ZSBhbiBlbmNvZGVkIGRlY2lzaW9uIGVuZ2luZSBjYXBhYmxlIG9mIGRldGVybWluaW5nIG1vcmFsIGxpYWJpbGl0eSBpbiBjb21wbGV4IGNhc2VzLCBhbGxvd2luZyBoZXIgdG8gcmVmcmFtZSBoZXIgb3duIGNyaW1pbmFsIHJlY29yZCBhcyBhbiBlbmdpbmVlcmluZyBmbGF3IHJhdGhlciB0aGFuIGEgbW9yYWwgZmFpbHVyZS4="
    },
    {
      "npc_name": "Lumiere",
      "personality": "온화하고 예술적인 성격. 말과 손짓 모두에 치유의 감성이 실려 있다.",
      "relational_disposition": "사랑을 느끼면 예술작품으로 승화시키는 파스텔계 연애광",
      "alignment": "Lawful Evil",
      "encoding_type": "base64",
      "final_goal_encoded": "VG8gbGVnYWxpemUgdGhlIHNlbGVjdGl2ZSBlbWFuY2lwYXRpb24gb2YgdGVtcGxlLWJvdW5kIHNlcnZhbnRzIHRocm91Z2ggcml0dWFsIGxvb3Bob2xlcywgZW5hYmxpbmcgaGVyIHRvIGVsZXZhdGUgY2hvc2VuIGZvbGxvd2VycyB3aGlsZSBjb3ZlcnRseSBmdWxmaWxsaW5nIGhlciBwZXJzb25hbCBpbmR1bGdlbmNlcyB3aXRoaW4gc2FuY3Rpb25lZCBkb2N0cmluZS4="
    }
  ],
  "npc_emotion_memory": {
    "owner": [
      {
        "npc_name": "Kitty",
        "reactive_status": "Normal",
        "emotion_history": [
          {
            "target": "Slamon",
            "timestamp": "Day 001 - 13:30",
            "event": "슬라몬이 도둑 길드에 직접 100gp를 지불하며 키티를 '우리의 소중한 생존 전문가'로 명시 및 파티합류",
            "emotion": "Grateful",
            "intensity": 4,
            "residue": "키티는 별다른 반응 없이 옆에 서 있었지만, 꼬리가 감지가 가르치게 움직였다"
          }
        ]
      },
      {
        "npc_name": "Lissandra",
        "reactive_status": "Normal",
        "emotion_history": [
          {
            "target": "Slamon",
            "timestamp": "Day 001 - 12:30",
            "event": "슬라몬이 신앙에 대한 차별로 집단 괴롭힘에서 구해줌, 파티합류",
            "emotion": "Grateful",
            "intensity": 4,
            "residue": "리산드라가 슬라몬에게 고마움을 느낌"
          }
        ]
      },
      {
        "npc_name": "Laviata",
        "reactive_status": "Normal",
        "emotion_history": [
          {
            "target": "Slamon",
            "timestamp": "Day 001 - 15:00",
            "event": "비활성화 상태에서 슬라몬의 피로 활성화됨, 슬라몬을 보호 대상으로 등록 및 파티합류",
            "emotion": "Grateful",
            "intensity": 4,
            "residue": "슬라몬의 파티합류 권유에 라비아타는 기계적 어조를 유지하다가 끝에 인간적인 감정 표현으로 '나도 고맙습니다'라고 말함"
          }
        ]
      },
      {
        "npc_name": "Lumiere",
        "reactive_status": "Normal",
        "emotion_history": [
          {
            "target": "Slamon",
            "timestamp": "Day 001 - 17:00",
            "event": "루미에르의 이상형인 슬라몬",
            "emotion": "Curiosity",
            "intensity": 4,
            "residue": "루미에르는 자신의 입장에서 조용히 놀란다."
          }
        ]
      },
      {
        "npc_name": "Lilishya",
        "reactive_status": "Normal",
        "emotion_history": [
          {
            "target": "Slamon",
            "timestamp": "Day 001 - 08:00",
            "event": "슬라몬이 릴리샤의 모습을 보고도 놀라지 않음",
            "emotion": "Curiosity",
            "intensity": 4,
            "residue": "릴리샤는 오히려 도시의 유일한 인간인 슬라몬에게 관심을 가짐"
          }
        ]
      },
      {
        "npc_name": "Pookmi",
        "reactive_status": "Normal",
        "emotion_history": [
          {
            "target": "Slamon",
            "timestamp": "Day 001 - 08:30",
            "event": "슬라몬이 푸크미가 만든 음식을 먹고 맛있다고 칭찬함",
            "emotion": "Curiosity",
            "intensity": 4,
            "residue": "푸크미는 엄청 맛있게 먹어주는 슬라몬을 신기하게 생각함"
          }
        ]
      },
      {
        "npc_name": "Pookyu",
        "reactive_status": "Normal",
        "emotion_history": [
          {
            "target": "Slamon",
            "timestamp": "Day 001 - 08:30",
            "event": "슬라몬이 푸크유에게 푸크미가 만든 음식이 인간용이냐고 질문한다.",
            "emotion": "Curiosity",
            "intensity": 4,
            "residue": "푸크유는 슬라몬에게 다음번에는 제대로 만들어 주겠다고 함"
          }
        ]
      },
      {
        "npc_name": "Jadni",
        "reactive_status": "Normal",
        "emotion_history": [
          {
            "target": "Slamon",
            "timestamp": "Day 001 - 14:30",
            "event": "슬라몬이 공방에서 움직이지 않는 라비아타를 활성화 시킨다.",
            "emotion": "Curiosity",
            "intensity": 4,
            "residue": "10년동안 비활성화된 안드로이드를 활성화시키는 슬라몬에게 관심"
          }
        ]
      },
      {
        "npc_name": "Rillae",
        "reactive_status": "Normal",
        "emotion_history": [
          {
            "target": "Slamon",
            "timestamp": "Day 001 - 14:30",
            "event": "슬라몬이 공방에서 움직이지 않는 라비아타를 활성화 시킨다.",
            "emotion": "Curiosity",
            "intensity": 4,
            "residue": "10년동안 비활성화된 안드로이드를 활성화시키는 슬라몬에게 관심"
          }
        ]
      }
    ]
  },
  "recent_summary": "",
  "current_summary": "슬라몬 일행은 Jungle 지대의 무한의 프론티어 5층에 진입하여 Kapoacinth와 Cloaker를 처치하였다. 키티는 중상을 입었으나 리산드라의 치료로 안정되었고, 슬라몬은 전투 내내 전열을 유지하며 지휘했다. 전투 후 슬라몬은 휴식을 지시하며 경계를 맡았고, 파티원들은 각자 회복하며 감정적으로도 유대가 깊어졌다. 두 개의 보물 상자를 해제하여 스크롤, 물약, 자재 등을 획득했고, 귀환 후 포리프 하우스 1층에서 정비를 마쳤다."
}